dataset,source,public_access,click_info,purchase_info,add_to_cart,timestamps,session_ids,exposure_order,hypothesis_coverage,key_limitations,overall_rating,downloaded
YOOCHOOSE (RecSys 2015),https://s3-eu-west-1.amazonaws.com/yc-rdata/yoochoose-data.7z,"YES - direct download, no auth",YES - 33M click events with session ID + timestamp + item ID + category,YES - 1.15M buy events with session ID + timestamp + item ID + price + quantity,NO,YES - millisecond precision,YES,Can construct within-session click order from timestamps,H1-H3 (no uncertainty/intent proxies beyond category),No explicit page position/rank; no search queries; no add-to-cart; category coding is opaque (numbers + special offers); no user IDs across sessions,HIGH - best fully-public dataset with click+purchase,True
REES46 Multi-Category Store (via HuggingFace),https://huggingface.co/datasets/kevykibbz/ecommerce-behavior-data-from-multi-category-store_oct-nov_2019,"YES - HuggingFace parquet, no auth required",YES - millions of 'view' events with timestamps,YES - purchase events with price,YES - cart events present,YES - second precision,YES - user_session field,Can construct within-session view order from timestamps,"H1-H5 (has category, brand, price for uncertainty/intent proxies)",No explicit page position/rank; no search queries; session = user_session UUID (may span long periods); timestamps at second granularity,HIGHEST - view+cart+purchase funnel with rich item metadata,True
UCI Clickstream (e-shop clothing 2008),https://archive.ics.uci.edu/static/public/553/clickstream+data+for+online+shopping.zip,YES - direct download,YES - 165K clicks with session ID + order + page location,"NO - all rows are clicks, no purchase outcome",NO,"NO - only year/month/day, no within-day time",YES,YES - explicit 'order' field (click sequence within session) + page location,H1 ONLY - no downstream purchase/conversion data,CRITICAL: No purchase events. Cannot test H2-H5. Only useful for attention/click-order analysis.,"LOW - click-only, no downstream outcomes",True
Retail Rocket / Retailrocket,https://www.kaggle.com/datasets/retailrocket/ecommerce-dataset,"BLOCKED - Kaggle login required, no public mirror with data files",YES (if accessible) - view events with visitor ID + timestamp + item ID,YES (if accessible) - transaction events,YES (if accessible) - addtocart events,YES - Unix timestamps,Visitor ID (not session ID),Can construct from timestamps within visitor sessions,"H1-H3 potentially, H4-H5 limited (item properties available but sparse)",BLOCKED: requires Kaggle authentication. No clean public mirror found. GitHub repos contain notebooks but not data files.,BLOCKED - worth manual Kaggle download later,False
Diginetica (CIKM Cup 2016),https://competitions.codalab.org/competitions/11161,BLOCKED - original competition site; data links likely expired,YES (if accessible) - view events with queries + rankings,YES (if accessible) - purchase events,Unknown,YES (if accessible),YES,Can potentially use search result rank as exposure order,H1-H5 potentially (has search queries for intent proxies),BLOCKED: competition data likely no longer downloadable. Some GitHub repos may have processed versions but lose key fields.,"BLOCKED - excellent if accessible, but likely unavailable",False
Coveo SIGIR eCom,https://github.com/coveooss/SIGIR-ecom-data-challenge,UNCERTAIN - may require agreement/application,YES (if accessible) - browsing events with search context,YES (if accessible) - add-to-cart and purchase,YES (if accessible),YES,YES,Can use search result position as exposure order,H1-H5 potentially (search queries + result positions),Access uncertain; may require data use agreement.,NOT TESTED - worth investigating manually,False
Taobao User Behavior (Alibaba),https://tianchi.aliyun.com/dataset/649,BLOCKED - requires Alibaba Tianchi account,YES (if accessible) - page view events,YES (if accessible) - buy events,YES (if accessible) - cart + fav events,YES - Unix timestamps,User ID (sessions must be constructed),Must construct sessions from timestamp sequences,H1-H3 potentially,BLOCKED: requires Chinese platform account. Some mirrors exist but quality uncertain.,BLOCKED - large and useful if accessible,False
